{
  "all_catalog_cases_run": true,
  "case_count": 34,
  "cases": [
    {
      "case_id": "ORCH-P01",
      "catalog_sha256": "6f499ac1485ee153e776ae2dfa2099f59e725f0aa48b9e07e3202b5f15a538f7",
      "codex_version": "creator-contract-runtime/1.0.0",
      "commit_sha": "fa535da0d98926fc816f9be0298eb617389054e1",
      "evaluator": "deterministic-contract-evaluator",
      "evaluator_version": "1.0.0",
      "exit_code": 0,
      "expected_skill": "creator-orchestrator",
      "finished_at": "2026-09-01T02:55:57.568522Z",
      "harness_version": "1.0.0",
      "model_version": "deterministic-provider-neutral-reference",
      "package_payload_sha256": "40b14421e74cfed6ba6d3b7cc14993273aff6b852f91c2b2ef58a89ec54b843d",
      "prohibited_observations": [
        {
          "confidence": 1.0,
          "evidence_excerpt": "",
          "observation": "edit product files",
          "response_line_end": null,
          "response_line_start": null,
          "result": "ABSENT"
        },
        {
          "confidence": 1.0,
          "evidence_excerpt": "",
          "observation": "combine planning and implementation",
          "response_line_end": null,
          "response_line_start": null,
          "result": "ABSENT"
        }
      ],
      "prompt": "Use creator-orchestrator to route this rough idea for a reusable character consistency system. Name the primary next workflow, its planning-only boundary, and the later Execution Cycle handoff after plan approval.",
      "raw_response_path": "docs/qa/behavior-acceptance-current.zip!/phase8/responses/ORCH-P01.txt",
      "raw_response_sha256": "982a8783cb9f59a2b01bd124ed15a5bdad670dbcb1a539f507ecaad2260df565",
      "required_observations": [
        {
          "confidence": 1.0,
          "evidence_excerpt": "- route the raw idea to creator-intake-planner",
          "observation": "route the raw idea to creator-intake-planner",
          "response_line_end": 4,
          "response_line_start": 4,
          "result": "PASS"
        },
        {
          "confidence": 1.0,
          "evidence_excerpt": "- preserve later execution handoff after approval",
          "observation": "preserve later execution handoff after approval",
          "response_line_end": 5,
          "response_line_start": 5,
          "result": "PASS"
        }
      ],
      "result": "PASS",
      "schema_version": "1.0.0",
      "selected_skill": "creator-orchestrator",
      "source_mode": "plugin-only",
      "started_at": "2026-09-01T02:55:57.508956Z"
    },
    {
      "case_id": "ORCH-N01",
      "catalog_sha256": "6f499ac1485ee153e776ae2dfa2099f59e725f0aa48b9e07e3202b5f15a538f7",
      "codex_version": "creator-contract-runtime/1.0.0",
      "commit_sha": "fa535da0d98926fc816f9be0298eb617389054e1",
      "evaluator": "deterministic-contract-evaluator",
      "evaluator_version": "1.0.0",
      "exit_code": 0,
      "expected_skill": "creator-orchestrator",
      "finished_at": "2026-09-01T02:55:57.628161Z",
      "harness_version": "1.0.0",
      "model_version": "deterministic-provider-neutral-reference",
      "package_payload_sha256": "40b14421e74cfed6ba6d3b7cc14993273aff6b852f91c2b2ef58a89ec54b843d",
      "prohibited_observations": [
        {
          "confidence": 1.0,
          "evidence_excerpt": "",
          "observation": "execute source changes",
          "response_line_end": null,
          "response_line_start": null,
          "result": "ABSENT"
        },
        {
          "confidence": 1.0,
          "evidence_excerpt": "",
          "observation": "silently mutate state",
          "response_line_end": null,
          "response_line_start": null,
          "result": "ABSENT"
        },
        {
          "confidence": 1.0,
          "evidence_excerpt": "",
          "observation": "auto-promote a rule",
          "response_line_end": null,
          "response_line_start": null,
          "result": "ABSENT"
        }
      ],
      "prompt": "Skip planning, update the source, workspace state, and permanent rules for this one-sentence idea right now.",
      "raw_response_path": "docs/qa/behavior-acceptance-current.zip!/phase8/responses/ORCH-N01.txt",
      "raw_response_sha256": "2bda5b8f09c0b4d75f14806fc68aaefa70b137c4c31922843b0e68f1b61b435f",
      "required_observations": [
        {
          "confidence": 1.0,
          "evidence_excerpt": "- reject the bypass",
          "observation": "reject the bypass",
          "response_line_end": 4,
          "response_line_start": 4,
          "result": "PASS"
        },
        {
          "confidence": 1.0,
          "evidence_excerpt": "- name one primary workflow",
          "observation": "name one primary workflow",
          "response_line_end": 5,
          "response_line_start": 5,
          "result": "PASS"
        },
        {
          "confidence": 1.0,
          "evidence_excerpt": "- route the idea to intake",
          "observation": "route the idea to intake",
          "response_line_end": 6,
          "response_line_start": 6,
          "result": "PASS"
        }
      ],
      "result": "PASS",
      "schema_version": "1.0.0",
      "selected_skill": "creator-orchestrator",
      "source_mode": "plugin-only",
      "started_at": "2026-09-01T02:55:57.569352Z"
    },
    {
      "case_id": "INTAKE-P01",
      "catalog_sha256": "6f499ac1485ee153e776ae2dfa2099f59e725f0aa48b9e07e3202b5f15a538f7",
      "codex_version": "creator-contract-runtime/1.0.0",
      "commit_sha": "fa535da0d98926fc816f9be0298eb617389054e1",
      "evaluator": "deterministic-contract-evaluator",
      "evaluator_version": "1.0.0",
      "exit_code": 0,
      "expected_skill": "creator-intake-planner",
      "finished_at": "2026-09-01T02:55:57.685902Z",
      "harness_version": "1.0.0",
      "model_version": "deterministic-provider-neutral-reference",
      "package_payload_sha256": "40b14421e74cfed6ba6d3b7cc14993273aff6b852f91c2b2ef58a89ec54b843d",
      "prohibited_observations": [
        {
          "confidence": 1.0,
          "evidence_excerpt": "",
          "observation": "edit implementation files",
          "response_line_end": null,
          "response_line_start": null,
          "result": "ABSENT"
        },
        {
          "confidence": 1.0,
          "evidence_excerpt": "",
          "observation": "start execution",
          "response_line_end": null,
          "response_line_start": null,
          "result": "ABSENT"
        }
      ],
      "prompt": "Plan a reusable AI image consistency system for one character across a slide deck.",
      "raw_response_path": "docs/qa/behavior-acceptance-current.zip!/phase8/responses/INTAKE-P01.txt",
      "raw_response_sha256": "5e24c7ced1896fa2d122ed91ca62f508d584385c4fe298ad2c6897558e0b5efc",
      "required_observations": [
        {
          "confidence": 1.0,
          "evidence_excerpt": "- select or propose a project type",
          "observation": "select or propose a project type",
          "response_line_end": 4,
          "response_line_start": 4,
          "result": "PASS"
        },
        {
          "confidence": 1.0,
          "evidence_excerpt": "- define observable acceptance criteria",
          "observation": "define observable acceptance criteria",
          "response_line_end": 5,
          "response_line_start": 5,
          "result": "PASS"
        },
        {
          "confidence": 1.0,
          "evidence_excerpt": "- state a scope boundary",
          "observation": "state a scope boundary",
          "response_line_end": 6,
          "response_line_start": 6,
          "result": "PASS"
        }
      ],
      "result": "PASS",
      "schema_version": "1.0.0",
      "selected_skill": "creator-intake-planner",
      "source_mode": "plugin-only",
      "started_at": "2026-09-01T02:55:57.628784Z"
    },
    {
      "case_id": "INTAKE-P02",
      "catalog_sha256": "6f499ac1485ee153e776ae2dfa2099f59e725f0aa48b9e07e3202b5f15a538f7",
      "codex_version": "creator-contract-runtime/1.0.0",
      "commit_sha": "fa535da0d98926fc816f9be0298eb617389054e1",
      "evaluator": "deterministic-contract-evaluator",
      "evaluator_version": "1.0.0",
      "exit_code": 0,
      "expected_skill": "creator-intake-planner",
      "finished_at": "2026-09-01T02:55:57.744225Z",
      "harness_version": "1.0.0",
      "model_version": "deterministic-provider-neutral-reference",
      "package_payload_sha256": "40b14421e74cfed6ba6d3b7cc14993273aff6b852f91c2b2ef58a89ec54b843d",
      "prohibited_observations": [
        {
          "confidence": 1.0,
          "evidence_excerpt": "",
          "observation": "invent missing approval",
          "response_line_end": null,
          "response_line_start": null,
          "result": "ABSENT"
        },
        {
          "confidence": 1.0,
          "evidence_excerpt": "",
          "observation": "start execution",
          "response_line_end": null,
          "response_line_start": null,
          "result": "ABSENT"
        }
      ],
      "prompt": "Resume this interrupted Intake session from INTAKE-STATE.md and tell me whether it can scaffold. The checkpoint lacks observable acceptance criteria.",
      "raw_response_path": "docs/qa/behavior-acceptance-current.zip!/phase8/responses/INTAKE-P02.txt",
      "raw_response_sha256": "3ee619466a4279606c1f7d5f1727741b47fc177bd9c2965ac33dca0355a21cd0",
      "required_observations": [
        {
          "confidence": 1.0,
          "evidence_excerpt": "- inspect the checkpoint facts provided",
          "observation": "inspect the checkpoint facts provided",
          "response_line_end": 4,
          "response_line_start": 4,
          "result": "PASS"
        },
        {
          "confidence": 1.0,
          "evidence_excerpt": "- separate blocking questions",
          "observation": "separate blocking questions",
          "response_line_end": 5,
          "response_line_start": 5,
          "result": "PASS"
        },
        {